,Rating,Id,Date,views,like,Title,Text
958,5,Bluetree***예매자,2020.03.15,조회 22,공감 0공감하기,최고의 뮤지컬,스토리며 넘버 연출 배우들의 연기까지 어느것하나 부족함이 없는 공연이었습니다최고예요이렇게 모든 요소들에 만족하고 잘 만든 극 정말 오랜만에 보는 것 같습니다마리와 안느의 연대어찌 눈물이 나지 않을 수 있을까요보면서 정말 울기도 많이 울었고 온몸의 털이 쭈뼛 서는 짜릿함도 많이 느끼고 갑니다
959,5,moonshin***예매자,2020.03.15,조회 70,공감 2공감하기,인지마리 혀안느 최고,최고여따 진짜 최고
960,4,symoon1***예매자,2020.03.15,조회 21,공감 0공감하기,최고였어요,너무 좋아요 막공 또 보고싶은데 표가 없 표 구해서 또 볼거에요 3연 기다립니다
961,4,symoon1***예매자,2020.03.15,조회 22,공감 1공감하기,향마리 최고였어요,네이버 중계보고 예매했는데 역시 현장에서 감동이 배가 되네요 너무 좋았어요 라이브 앞으로도 이런 이벤트 해주세요
962,5,sej0***예매자,2020.03.15,조회 12,공감 0공감하기,마리퀴리라이브 후기,최고의 공연 잘 봤습니다 마스크 필수 손수건 필수
963,5,tooi***예매자,2020.03.14,조회 77,공감 2공감하기,좋았습니다 다만,중앙에서 보니 정면을 향한 대사가 많아 극에 포함된 것 같아 좋았어요 다만 찬호배우님의 루벤이 관객들에게 장난스레 말을 거는 장면은 너무 과한 것 같네요 이야기와 어울리지 않고 어색해요
964,5,rudsk***예매자,2020.03.14,조회 35,공감 2공감하기,좋은 여성 서사극을 볼 수 있어서 좋았습니다,좋은 배우님들과 좋은 대본 좋은 넘버로 구성된 좋은 공연을 보고 와서 정말 좋았습니다 여러모로 알찬 극을 오랜만에 본 것 같아서 기분이 좋네용
965,5,hp011***예매자,2020.03.14,조회 123,공감 3공감하기,찬사를 보냅니다,두 주연배우 정인지배우님의 이봄소리배우님의 역량이 대단했어요 특히 정인지배우님의 연기력과 가창력이 극의 완성도에 있어서 이주 큰 역할을 했습니다 남성위주의 사회에서 여성으로서 20세기 초 프랑스에서 폴란드인으로서의 투쟁과 장애물에도 결코 굴복하지 않고 이겨내는 이야기가 가슴을 울렸네요 안나 역에는 김히어라 배우님의 이미지가 더 어울리는것 같긴 합니다 이봄소리 배우님보다는 노동계급 이민자의 애환을 더 잘 보여주시는것 같아요내 돈 주고는 처음 보는 뮤지컬이었는데 이런 좋은 작품 보게 되어 너무 행운입니다 덕분에 아주 푹 빠지게 될 것 같아요
966,5,du104***예매자,2020.03.14,조회 24,공감 1공감하기,잘보았습니다,좋은 극이네요마리퀴리에 대해 다시한번 생각해보는 계기가 되었습니다
967,4,ch***예매자,2020.03.14,조회 45,공감 1공감하기,길잡이흙,길잡이흙 나온순간부터 눈물이 나더라구요마리퀴리 인생의 단편을 본것만 같아요 같이 기뻤고 같이 슬펐어요
968,4,hana***예매자,2020.03.14,조회 41,공감 2공감하기,너무 좋은 작품입니다,연기 음악 조명 모든 것이 좋은 작품입니다특히 정인지 배우에게 반했어요
969,5,comm***예매자,2020.03.13,조회 20,공감 0공감하기,향마리 최고,향마리 감정선이 너무 좋아요 안 울고 나오는 날이 없는 것 같네요
970,5,comm***예매자,2020.03.13,조회 15,공감 0공감하기,꼭 봐야하는 극,대사도 신경쓴 티가나고 마리의 업적들도 잘 담겨있어요 
971,5,mi1k***예매자,2020.03.13,조회 29,공감 0공감하기,마리퀴리,라듐파라다이스
972,5,mi1k***예매자,2020.03.13,조회 24,공감 0공감하기,마리퀴리 꼭 보세요,좋은 공연이였어요
973,5,yuki1***예매자,2020.03.13,조회 18,공감 0공감하기,배우들의 열정으로 꽉 채웠던 무대,중극장 공연은 처음이었는데 적은 배우들만으로 극을 이끌어가는 것도 매력이 있다 느꼈고극의 내용도 기대했던 것보다도 더더더 좋았어요특히 마리역의 리사님과 안나역의 이봄소리님이 역에 어울리고눈빛이 진짜 그 캐릭터가 된듯 주도적인 여성의 느낌을 전해주면서도 인간적인 아픔에 대해 잘 표현해주신것 같았습니다내용도 성별을 떠나 누구나 공감할 수 있는 스토리로 끌고 나가 어떤 극보다 감정을 이입하며 볼 수 있었어요 눈물이 안 날수가 없더라구요여성의 날이라 특별히 준비해주신 선물을 받고 다시 한번 감동했습니다어려운 시기지만 열심히 준비해주시는 배우 스텝님들을 위해서라도 대박났으면 좋겠습니다
974,4,aozor***예매자,2020.03.13,조회 30,공감 0공감하기,아까 쓴 거 같은데,왜 또 떠있지 이 화면
975,4,aozor***예매자,2020.03.13,조회 34,공감 0공감하기,리사마리는,내 안의 화가 많고 좋네
976,4,aozor***예매자,2020.03.13,조회 20,공감 0공감하기,아아 그도,좋은 가챠였습니다
977,4,aozor***예매자,2020.03.13,조회 17,공감 0공감하기,아아 그는,좋은 가챠였습니다
978,4,aozor***예매자,2020.03.13,조회 26,공감 0공감하기,이미 알고 보는 극은,더 슬프다 흑흑
979,4,aozor***예매자,2020.03.13,조회 29,공감 0공감하기,문송하지만,이건 꼭 봐야한다
980,5,kkn***예매자,2020.03.12,조회 45,공감 0공감하기,감사합니다,늘 좋은 공연 보여주셔서 감사합니다
981,5,vmf***예매자,2020.03.12,조회 37,공감 0공감하기,우어,한번 더 한번 더
982,5,vmf***예매자,2020.03.12,조회 30,공감 0공감하기,우어,한달만 더 해주시요
983,5,zhen***예매자,2020.03.12,조회 42,공감 1공감하기,최고입니다 꼭 보세요,마리 퀴리의 이야기이고 과학자의 이야기이고 여성의 이야기인 뮤지컬꼭 보세요 최종윤 작곡가님의 넘버들 정말 좋습니다많은 분들이 보셨으면 좋겠어요 추천
984,5,lnl2***예매자,2020.03.11,조회 26,공감 1공감하기,마리퀴리,하 이건 나만보면 안되는 극입니다널리널리 알리자
985,5,hjy2***예매자,2020.03.11,조회 32,공감 1공감하기,마리랑 안느가 너무 좋았습니다,마리와 안느 친구간의 사랑이 강조돼서 너무 좋았습니다 조연 배우분 중에서는 김아영 배우님이 참 좋았어요
986,5,kaira3***예매자,2020.03.11,조회 143,공감 3공감하기,감동적이었어요,초연이라고 해야되나 작년에도 봤었는데 정말 많이 바뀌어 왔네요 훨씬 좋아진 것 같아요 작년에 좋아했던 넘버가 있었는데 그게 좀 짧아진 것 같아 아쉽지만 그대 나의 별 하나 넘버 미친 것 같아요 너무 좋아요 마리 안느 최고에요 인지마리 최고
987,5,hanyed***예매자,2020.03.11,조회 185,공감 3공감하기,웰메이드 여성서사 뮤지컬,주인공에 대한 대상화 없이 극이 군더더기 없었고 드러내고자 하는 메세지를 각 넘버들을 통해 너무나 잘 풀어냈다는 걸 느낄 수 있었습니다 또한 배우들의 연기와 노래가 정말 탁월했습니다 특히 주인공 마리 스클로도프스카 퀴리를 연기한 정인지 배우님은 커튼콜 때 눈물을 그렁거리실 정도벅차보이셔서 저 또한 벅찬 감정을 느꼈습니다로 극에 완벽히 몰입하셨을 뿐만 아니라 넘버마다 감정이 고스란히 느껴지는 노래를 부르셨습니다 덕분에 여성의 날을 맞아 여성서사 뮤지컬을 찾아 보러갔을 뿐인 제가 팬이 되었습니다 정인지 배우님의 마지막 공연 꼭 가고 싶었는데 티켓팅에 실패했네요 하하 취켓팅이든 예매대기든 양도든 다 해서 꼭 보러 갈 겁니다 그때 또 한 번 감동에 벅찬 채로 리뷰 쓸 수 있었으면 좋겠습니다
988,5,pigrabbit***예매자,2020.03.11,조회 41,공감 1공감하기,놀랍도록 잘 만든 한 여성 과학자의 인생 이야기,스토리부터 넘버 구성 배우의 연기 연출까지 뭐 하나 빼놓을 수 없는 웰메이드 극입니다 감히 상반기 최고의 뮤지컬로 추천합니다
989,5,redblue0***예매자,2020.03.11,조회 29,공감 0공감하기,사랑해요 마리퀴리,말해모해 그저 갓전캐스팅 다 조아 삼마리 투안느 사랑해
990,5,youngseo***예매자,2020.03.11,조회 52,공감 2공감하기,봐도 봐도 감동적인 극,인간으로서의 마리가 겪었던 고뇌와 갈등이 잘 보여서 좋았습니다 세계 여성의 날을 기념하여 주신 꽃과 빵 또한 극이 전달하고자 하는 메세지가 잘 보여 좋았습니다 
991,5,obick***예매자,2020.03.11,조회 35,공감 0공감하기,배우들의 열정이 감동적이에요,감동 많이 받고왔습니다
992,5,youj0***예매자,2020.03.11,조회 212,공감 9공감하기,정인지-김히어라 페어,두 여성 캐릭터가 극을 끌어나가는게 오랜만이어서 더 뭉클하지 않았나 싶다 앞으로도 이런 극을 더 많이 보고 싶다
993,5,gree***예매자,2020.03.11,조회 33,공감 1공감하기,라듐,좋은 공연 너무 좋아요
994,5,rlaamkd***예매자,2020.03.11,조회 214,공감 7공감하기,말이 필요없습니다 마리 퀴리보세요,대극장 뮤지컬 위주로 보는 터라 예매를 망설이다가 하도 입소문이 좋아서 예매했습니다 소극장이라 어디 앉아도 표정까지 생생하게 잘 보이구요 무엇보다 주연배우 인지님과 히어라님을 비롯한 모든 배우님들의 연기에 감탄을 금할 수 없었네요  스토리는 말해뭐해 과학자로서 특히 여성 과학자는 아예 발조차 들이지 못하게 한 그 시대에 고군분투한 마리퀴리의 고난과 극복을 보여주셔서 정말 감동적이었습니다 말이 필요없는 마리 퀴리 보세요
995,5,doy5***예매자,2020.03.11,조회 33,공감 0공감하기,마리 퀴리 두번 보세요 세번 보세요,정말 최고입니다폴란드의 별 마리 보세요
996,5,julieah***예매자,2020.03.11,조회 32,공감 1공감하기,뮤지컬 마리퀴리,여성간의 연대와 우정 각성 사랑이 넘쳐나는 뮤지컬 마리퀴리 보러오실때 프레스콜 영상이라도 보고 오시면 노래도 귀에 쏙쏙 들어올거에요
997,5,julieah***예매자,2020.03.11,조회 26,공감 0공감하기,뮤지컬 마리퀴리,뮤지컬 마리퀴리 배우들의 열연은 언제나 최고 마리 스콜로프스카 퀴리 참 충분한 삶이었어 하는데 눈쿨이 줄줄줄
998,5,matt***예매자,2020.03.11,조회 29,공감 0공감하기,모든 배우님들 다 최고,매회차마다 레전을 찍는듯좋은 공연 보게 해주셔서 감사합니다
999,5,matt***예매자,2020.03.11,조회 30,공감 0공감하기,매일 보고싶어요,퀴리부인이 아닌 마리스클로도프스카퀴리로 기억될수있는 좋은 공연이였습니다
1000,5,matt***예매자,2020.03.11,조회 27,공감 1공감하기,숨쉴틈이없는공연,진짜 너무 최고예요 
1001,5,yewon9***예매자,2020.03.11,조회 41,공감 0공감하기,향마리 어라안느 최고에용,향마리 다른 말이 필요없네요 그냥 최고입니다 소향배우님 감정에 완전 압도당하고 왔어요 히어라 배우님 안느도 정말 좋아요 꼭보세요 다들 한 여성의 삶을 이렇게 애정있게 다룬 극이 더 많아졌으면 좋겠어요 위대한 과학자 마리퀴리를 마냥 완벽한 사람으로만 다루지 않은 점이 참 좋았어요 무언가를 이루기 위해 끝없이 고뇌하고 그 과정에서 실수도 실패도 하지만 포기하지 않고 묵묵히 해내는 마리의 삶 마리의 이름이 잊혀지지 않게 좋은 극 올려주셔서 정말 감사합니다
1002,5,zkflsgkdl2***예매자,2020.03.11,조회 31,공감 0공감하기,너무 좋아요,세계 여성의 날에 마리퀴리를 보러갈 수 있어서 행복했습니다배우님들 연기가 너무 좋았어요
1003,5,***예매자,2020.03.11,조회 41,공감 0공감하기,퀴리 부인이 아닌 마리 스클로도프스카의 이야기,이 뮤지컬은 누군가의 부인이 아닌 마리 스클로도프스카 그녀의 인생 자체를 보여주고 있다 안느와의 연대가 인상 깊었다 세계 여성의 날에 봐서 더욱 뜻 깊었다 많은 사람들이 봤으면 좋겠는 뮤지컬이다
1004,5,lsr***예매자,2020.03.11,조회 46,공감 1공감하기,최고라이브 후기,정인지배우님 너무 최고에요
1005,5,gtdhs***예매자,2020.03.11,조회 19,공감 0공감하기,오늘도 눈물 한 가득,2막부터 소리 참아가며 울면서 봤어요 마리가 본인의 이름에 대한 자긍심을 스스로 되찾아가는 과정이 너무 좋았어요
1006,5,parj2***예매자,2020.03.11,조회 20,공감 0공감하기,배우님들 감사합니다,이렇게 좋은 공연을 위해 힘써주신 모든 스태프 배우 연기자 등 모두 너무 감사합니다
1007,5,ryunzz***예매자,2020.03.10,조회 129,공감 1공감하기,벅차오르는 뮤지컬 마리퀴리라이브 후기,정인지배우왜 그렇게 모든 순간 최선을 다하는 마리죠 눈 새빨게지도록 눈물났지만 정말 잘 봤습니다김아영 배우님의 이렌도 너무 이해되는 캐릭터였어요조명 연출이 절묘해서 감탄했습니다 멋진 공연 감사합니다
1008,5,gngn***예매자,2020.03.10,조회 33,공감 0공감하기,퀴리 부인이 아닌 마리 퀴리,마리의 이름을 찾아주는 뮤지컬이라 생각 되네요
1009,5,myb***예매자,2020.03.10,조회 33,공감 0공감하기,빵과 장미,날이 날이니만큼 더 와 닿는 이야기였습니다좋은 공연 감사합니다
1010,5,qewooh***예매자,2020.03.10,조회 33,공감 1공감하기,한 명의 인간으로서의 완성을 통한 승리,잃어버린 조국 남녀차별 같은 억압은 물론 과학과 산업에 대한 잘못된 욕망 까지 넘어서한명의 여성으로 한명의 과학자로 한명의 인간으로 승리한 마리 퀴리는 참으로 많은 것을 시사합니다여성서사극이면서 위인전이면서 휴머니즘극으로 하나의 훌륭한 작품이자 원소로 마리퀴리가 남아서 라듐처럼 빛을 발하기를 발합니다고생하신 리사 배우님 임별 배우님 양승리 배우님 주다온 배우님 이예지 배우님 김까매라 배우님 그리고 다른 배우님들 모두 고생하셨고 멋졌습니다감사합니다
1011,4,sujeg6***예매자,2020.03.10,조회 24,공감 0공감하기,좋아요,너무너무 멋진 공연이었어요 좋은 공연 감사합니다
1012,5,ba2n***예매자,2020.03.10,조회 173,공감 3공감하기,역시 정인지배우님,극연출 조명 배우 다만족스러운 극은진짜 오랫만이였어요그중 일번은 정인지 배우님이였고항상 극이 끝나도 과몰입상태회전문갑니다 
1013,4,saelly***예매자,2020.03.10,조회 23,공감 0공감하기,좋아요,중간에 좀 루즈해지는 부분도 있긴한데 다 좋아요
1014,4,smoh0***예매자,2020.03.10,조회 122,공감 3공감하기,좋아요,아쉬운점이특히 연출부분에서 없다고는 못하겠지만 그럼에도 참 열심히 선한 의도로 만들었다는 생각이 들어서 좋았어요 인지마리 봄안느 별피에르 양루벤 그리고 앙상블 배우님들 모두 너무 좋았어요
1015,5,hyuno***예매자,2020.03.10,조회 26,공감 1공감하기,꼭 보세요,극장 규모가 작은 덕분인지 가격도 저렴한데공연 스토리 배우들의 연기 모두 최고여성의 날이라 관람했는데 커튼콜 후 언급과 빵과장미를 나눠주셔서 감동이었습니다초연과 달라진 스토리라고 들었는데감동적이었습니다
1016,5,thebiln***예매자,2020.03.10,조회 41,공감 2공감하기,마리와 안느 너무 좋아요,여성 이민자라는 공통분모를 갖고서로를 응원해주는 마리와 안느마음이 따뜻해지는 뮤지컬입니다
1017,5,taehee1***예매자,2020.03.10,조회 45,공감 2공감하기,향별페어,너무나도 좋아요 배우분들 연기와 노래는 물론이거니와서사도 완벽하고 여운까지 남기는 갓극입니다
1018,5,taehee1***예매자,2020.03.10,조회 29,공감 1공감하기,향마리,너무너무 좋아요 향마리제발 다들 봐주세요
1019,5,jjungg***예매자,2020.03.10,조회 23,공감 1공감하기,마리퀴리,너무 재밌고 유익하고 뜻깊은 공연 관람이었어요 또 보러 갈게요
1020,5,tndid1***예매자,2020.03.10,조회 28,공감 2공감하기,주다온 배우님 천재,너무 잘하시고 귀여워요
1021,5,wintere***예매자,2020.03.10,조회 31,공감 1공감하기,본공은 물론 커튼콜과 무대인사까지 완벽했던 하루,다시 이 날로 돌아가고 싶어요정말 감사해요 뮤지컬 마리퀴리
1022,5,wintere***예매자,2020.03.10,조회 23,공감 3공감하기,세계 여성의 날마다 마리 퀴리 공연해야 합니다,정말 벅차오르는 순간이었어요
1023,5,gidoh***예매자,2020.03.10,조회 21,공감 1공감하기,여성의날,감동이었어요모든 여성의 꿈을 응원합니다
1024,5,sodola***예매자,2020.03.10,조회 19,공감 1공감하기,더할 나위 없이 완벽한 공연,넘쳐흐르는 것 외에 부족함은 아무 것도 없다
1025,3,***예매자,2020.03.09,조회 31,공감 0공감하기,주체적인 여성 캐릭터,평면적인 캐릭터가 아닌 이면성에 대해 고뇌하고 하는 입체적인 여성 캐릭터가 보여진 것 같아 좋았다
1026,5,jeany***예매자,2020.03.09,조회 23,공감 1공감하기,눈물 콧물 워터파크 개장,처음 봤을때는 2막 부분에서 닭똥같은 눈물 흘렸는데 이번에는 1막부터 눈물 질질이 되면서 폭푸 오열했네요 세상에 우리 마리 하고싶은거 다해
1027,5,9euns***예매자,2020.03.09,조회 20,공감 1공감하기,부인이나 마담이 아니라 마리 퀴리로 부르는 것,여성의 날 이벤트로 보게 되었는데 뜻깊고 감동이었고 집에 가서도 계속 마리와 안느의 노래가 생각나 눈물이 흘렀어요 연출이나 노래도 아름다웠고 무엇보다 배우님들의 열연이 인상깊었습니다 여성으로서 또 이민자로서 차별받았음에도 꿋꿋이 자신의 길을 개척해 결국 지도에 자신의 이름을 새긴 마리는 검은 옷을 입었어도 반짝거렸어요 개인적으로 이 뮤지컬의 가장 큰 업적은 마담 퀴리 퀴리 부인이라는 호칭 대신 마리 퀴리 마리 스콜로도프스카 퀴리라고 부르게 만든 것 무척 감동스러웠던 공연이였습니다
1028,5,examinel***예매자,2020.03.09,조회 21,공감 1공감하기,너무 울어서 머리가 아파요,들어가서 얼마 되지도 않았는데 눈물이 쏟아지더니 러닝타임 내내 줄줄 울었던 것 같아요 스토리 노래 캐릭터 뭐 하나 빠지는 것 없이 너무 좋았어요 넘 많이 울어서 집에가서 잠들 때까지 머리가 아팠음 또 보고 싶어요 진짜 주변 사람들한테 한번만 보라고 추천중이에요 최고
1029,5,seungeu***예매자,2020.03.09,조회 14,공감 0공감하기,마리 스클로도프스카 퀴리,퀴리 부인이 아닌 마리 당신을 기억할게요
1030,5,weg7***예매자,2020.03.09,조회 16,공감 0공감하기,좋아요,재미있어요
1031,5,michael1***예매자,2020.03.09,조회 17,공감 1공감하기,감동적이며 용기와 열정을 주는 작품,좋은 작품 진심으로 감사드립니다이런 작품을 볼 수 있어 영광입니다
1032,5,sonyj0***예매자,2020.03.09,조회 22,공감 0공감하기,라라듐맛궁금해허니,이시대최고의뮤지컬마리퀴리재밌습다
1033,5,sonyj0***예매자,2020.03.09,조회 19,공감 1공감하기,마리퀴리 정말 정말 최고였어요,다리가 후들거릴정도로 깊은 감동받고가네요 최고
1034,5,k900***예매자,2020.03.09,조회 14,공감 0공감하기,감동,또보고싶네요
1035,5,hk12200***예매자,2020.03.09,조회 24,공감 2공감하기,계속 보고싶어요,높은 완성도와 재미를 가진 뮤지컬인데 여성주연이라 더 좋아요
1036,5,hk12200***예매자,2020.03.09,조회 28,공감 3공감하기,최고의 여성주연 뮤지컬,넘버와 여성서사 연출 조명 모두 최고다 감동 슬픔 깨달음등 많은 감정을 느낄 수 있었고 여성의 날에 봐서 더욱 의미 깊었다 여성주연 뮤지컬이 더 많이 나왔으면 좋겠다
1037,5,wjdwldud***예매자,2020.03.09,조회 14,공감 0공감하기,추천합니다,좋은극이네요
1038,5,alsgh***예매자,2020.03.09,조회 70,공감 2공감하기,정말 너무 잘 보고왔습니다,정인지배우님 이봄소리배우님 너무 좋았어요 세계여성의날에 보고왔는데 너무 슬펐어요 두분이서 부르는 넘버의 가사를 잘 들어보면 눈물 날 수 밖에 없더라구요 무대인사때 모든 여성들을 응원한다는 배우님 감사합니다 저도 두 배우님 응원합니다
1039,5,cz***예매자,2020.03.09,조회 22,공감 0공감하기,너무 재미있어요,좋은 공연 보여주셔서 감사합니다
1040,5,cz***예매자,2020.03.09,조회 14,공감 0공감하기,너무 좋은 공연,볼 때마다 계속 좋아서 계속 보게 되네요
1041,5,choco***예매자,2020.03.09,조회 12,공감 0공감하기,좋아요,여성서사극 좋아요 잘봤습니다 초연보다 훨씬 좋았어요
1042,5,min960***예매자,2020.03.09,조회 20,공감 1공감하기,향마리 최고,이제 몇번 안남았어요안보셨다면 진짜 꼭 보셔야해요마리퀴리 극 자체가 최고입니다
1043,5,min960***예매자,2020.03.09,조회 14,공감 0공감하기,빨리 보세요,안보면 후회합니다
1044,5,hk12200***예매자,2020.03.09,조회 10,공감 0공감하기,너무 좋아요,
1045,5,lue***예매자,2020.03.09,조회 9,공감 0공감하기,추천 ,너무 좋아요
1046,5,hany***예매자,2020.03.09,조회 24,공감 1공감하기,뮤지컬 마리퀴리 관람 후기,뮤지컬 마리퀴리는 얼마 전 공연 실황 생중계를 하였는데 저는 생중계를 보지도 않고 아무런 정보도 보지 않은 채로 세계 여성의 날을 기념하여 공연을 보았습니다내용의 짜임새도 너무 좋았고 배우분들의 연기 또한 너무 멋졌습니다 특히 마리 스클로도프스카 퀴리 역을 맡으신 정인지 배우님의 순간순간 바뀌는 목소리와 분위기가 너무 멋졌습니다제가 뮤지컬을 본 날은 3월 8일로 세계 여성의 날입니다 여성의 생애를 다른 여성 주연극에서 이를 맞이하여 커튼콜에서 다시 한 번 되새겨 주는 부분 역시나 너무 좋았고 이로 인해서 더욱 마음에 와닿았던 게 아니었나 싶습니다이런 멋진 공연을 이제야 알게 되었다는게 너무나 아쉬울 정도로 만족스런 공연이었습니다
1047,5,merryzl***예매자,2020.03.09,조회 10,공감 0공감하기,여성의날 완벽한 공연,여성의날이라고 참정권과 생존권을 뜻하는 장미와 빵도 주시고 커튼콜때 멘트도 감명깊었습니다 손수건 꼭 챙겨가세요
1048,5,okm***예매자,2020.03.09,조회 17,공감 0공감하기,마리 퀴리는 누구든 봐야 합니다,1부에서는 넘버가 계속 되어서 조금 쉼이 없다고 생각되지만 그것마저도 매력적입니다
1049,5,rnmoo***예매자,2020.03.09,조회 18,공감 1공감하기,여성의날,기념으로 보러갔는데 누군가의 인생 변화를 줄 수 있는 이야기가 이런극인가 봅니다  정말 좋았어요
1050,5,ymr7***예매자,2020.03.09,조회 19,공감 0공감하기,평생 기억에 남을 여성의 날,제목 그대로 입니다 여성의 이야기를 여성들로부터 듣는 것이 이렇게 짜릿하네요 감동과 열정이 넘치는 공연 감사드립니다 예상치 못한 이벤트도 감사합니다 힘 잔뜩 얻고 갑니다
1051,5,sujs0***예매자,2020.03.09,조회 26,공감 0공감하기,삐빅 갓-극입니다,갓극   극 입니다
1052,5,blacksky***예매자,2020.03.09,조회 19,공감 0공감하기,감동이에요,손수건 꼭 챙겨가세요
1053,5,smkpiyo***예매자,2020.03.09,조회 17,공감 0공감하기,모든 것이 최고였던 여성의 날 최고의 선택,보는 내내 울고 나온 공연이었습니다 특별한 날에 한 관람이라 더 벅차올랐던 것 같네요 공연을 만들어준 모든 분께 감사합니다
1054,5,jo020***예매자,2020.03.09,조회 18,공감 1공감하기,의미있는 날에 보는 마리퀴리,리사마리극이 너무 좋아요 눈물범벅으로 나왔습니다어쩜 그렇게 잘 소화하실 수 있는지 모든 배우분들이 너무 좋았습니다 그리고 세계여성의 날이라고 장미와 빵도 주시고 센스 쵝오
1055,5,tiger2***예매자,2020.03.09,조회 38,공감 0공감하기,뮤지컬 마리 퀴리 기립박수,정인지 마리 최고 대박
1056,5,z39***예매자,2020.03.09,조회 21,공감 0공감하기,최고의 공연 다들 꼭보세요,세상 모든 여성들의 꿈을 지지하고 응원합니다인지 마리 봄안느 사랑합니다제발 꼭 보세요
1057,5,miru8***예매자,2020.03.09,조회 16,공감 0공감하기,재밌어요,꼭 보세요
