,Rating,Id,Date,views,like,Title,Text
1812,5,tina3***,2020.02.10,조회 77,공감 1공감하기,역사에 남을 여성서사극,지난 트라이아웃 공연 때는 모두들 알겠지만 조금 실망스럽기도 했습니다이번 초연은 그를 만회하듯 전보다 탄탄한 마리와 안느의 서사가 돋보였고 라듐공장 직공들의 이야기도 개연성 있게 흘러가 흐름을 파악하기 편했습니다 전보다 강단있는 마리의 성격이 마음에 들었고 어디선가 본 듯한 시작 부분은 아직까지도 기억에 남습니다 배우들이 이 무대에 익숙해진다면 최고의 작품이 될 거라 생각합니다 최고
1813,4,jksun***예매자,2020.02.10,조회 159,공감 3공감하기,너무 멋진 두 여성의 이야기,초연때보다 많이 수정되어 좋아졌다는 얘기들었는데저는 초연공연은 못봤으나 이번 2020년 공연은 너무 좋았습니다자칫 지루할 수 있는 과학이야기인데 빠르게 전개되고 다양하게 변주되는 음악에 지루함을 느낄 틈이 없었답니다 무엇보다 소극장 공연임에도 라이브로 음악이 연주된다는 점또한 큰 박수를 보냅니다 많은 분들이 보면 좋겠네요 김소향님 이봄소리님 너무 멋져요
1814,5,gusal2***예매자,2020.02.10,조회 128,공감 3공감하기,향마리,최고에요 2막때 마스크 젖을만큼 울었어요한 번 더 볼거에요
1815,5,jesy2***예매자,2020.02.10,조회 83,공감 3공감하기,멋있는 주인공,호기심과 열정에 가득찬 주인공의 모습은 무척 멋있었습니다
1816,5,namgoon***예매자,2020.02.10,조회 201,공감 5공감하기,정말 감격스러운 공연이었습니다,공연보면서 매 순간 감동받았습니다스토리도 정말 좋았고 배우들 연기 노력 안무와 무대 조명 사용도 신선했어요무엇보다 마리와 안느 두 인물을 중심으로 극을 볼 수 있었다는게 정말 좋았고 행복했습니다여덟 분이 누구 한 명 빼놓을 수 없을 만큼 모두 꽉차게 각자의 역할을 잘 해주셔서 정말 멋있었습니다아무래도 또 봐야할 것 같아요 그리고 중앙 좌석 시야가 정말 좋네요
1817,5,hbsj***예매자,2020.02.10,조회 58,공감 1공감하기,마리퀴리의 일생을 한번에 볼 수 있는 극,무대가 화려하거나 한건 아니였지만 극에 필요한 충분한 요소는 갖춰진 느낌이고 영상과 조명등 구성이 짜임새있게 들어가있어 몰입도가 좋았다이번에 올리면서 인터미션이 생겼는데흐름이 끊긴다는 의견도 있는것 같았으나 개인적으로는 나름 끊고 이어졌다고 생각함2시간 넘는 시간을 쭉 달리면 더 집중을 못 했을 것 같기도하고어떻게보면 어려운 얘기 일 수도 있는데 쉽게 이해하며 볼 수 있었고마리뿐만 아니라 다양한 사람들의 삶을 볼 수 있어서 좋았음넘버도 다 좋고 사운드도 좋았음
1818,4,allison7***예매자,2020.02.10,조회 77,공감 2공감하기,감탄스러웠던 작품,마리퀴리와 안느 그 주위에 있던 사람들을 한명도 놓치지 않고 빛을 내게 해주려 한 연출 좋았습니다
1819,5,aae***예매자,2020.02.10,조회 47,공감 1공감하기,너무 좋았어요,여성이 여자라는 캐릭터로 등장하는 게 아니라 실수하고 고뇌하는 인간으로 그려진 게 너무 좋았습니다 가까이서 본 건데 멀리서 보면서 무대 전체를 한 분 더 보고 싶어요 배우님들 성량도 너무 좋으시고 넘버도 좋아서 귀호강 했습니다 꼭 보세요 최고예요
1820,4,kanon***예매자,2020.02.10,조회 50,공감 1공감하기,잘 보고 왔습니다,티켓꽂이가 탐나서 보게 되 뮤지컬 <마리퀴리> 프리뷰로서 뮤지컬을 본 건 처음이다전체적으로 재미있게 보기는 했다 내용이 실존 인물을 모티브로 한 것이라서 엄청 지루할 줄 알았는데 그렇지는 않았다 엉엉 우는 배우들을 보며 대단하다는 생각도 들었다무대는 원형이라서 자리 선정이 중요할 것 같다 무조건중앙으로아쉬운 게 있다면 무대 뒤 백이 너무 시끄러웠다 신발 소리 물건 옮기는 소리가 크게 들린다는 것프리뷰라 그런 건가무튼 재미있게 잘 보았으니 만족
1821,5,skxo***예매자,2020.02.10,조회 79,공감 2공감하기,여성끼리 연대하는 공연 너무 좋습니다,초연은 안 봤는데 이번 재연에 마리와 안느 두 여성이 주연인 걸 보고 바로 예매했었어요초연에서 많이 갈아엎었다고 했는데 그럼에도 불구하고 서사적으로 빈틈은 거의 느껴지지 않았고 프리뷰 기간인데도 배우분들 합도 괜찮았습니다크게 기대하지는 않랐었는데 마리와 안느가 연대하고 서로 이해하고 공감하는 것에 감동받아서 두 번째 표를 물색하고 있습니다
1822,4,so***예매자,2020.02.10,조회 48,공감 1공감하기,좋았어요,배우분들 모두가 정말 믿보배셔서 그런지 너무너무 좋았습니다 또 마리 퀴리라는 인물에 대해 이야기는 하는 극이기에 더 좋았네요
1823,5,moonlight1***예매자,2020.02.10,조회 36,공감 1공감하기,꼭 봐야할 극,너무너무 재밌게 잘 봣습니다
1824,5,fbwldnd1***예매자,2020.02.10,조회 62,공감 2공감하기,역전의 묘미,마리퀴리 는 한 캐릭터가 꿈을 향해 달려가다가 친구로 인해 위로도 받고 자극도 받으며 매진하다가 자신의 로맨틱한 관계의 파트너의 희생으로 인해 각성하고 마지막엔 친구에 의해 용서받는 등의 클리셰가 가득합니다 하지만 이 클리셰들의 성별이 뒤집혔을때 얼마나 큰 감동이 올수있는지는 직접 확인해야 합니다 만약에 두 여성 캐릭터의 우정서사가 너무 뻔하다고 생각된다거나 어색하게 느껴진다면 우린 지금껏 명작으로 칭송받던 수많은 작품들을 다시 한 번 생각해봐야 할지도 모릅니다
1825,4,haley1***예매자,2020.02.10,조회 69,공감 0공감하기,어려웠던극이었네요,배우님들 연기는 너무너무 좋았지만 소재가 어려웠어요라듐은 잊지못할꺼같네요또 너무 슬펐어요 2막때는 너무 슬펐는
1826,5,wmuwse1***예매자,2020.02.10,조회 45,공감 2공감하기,정말 충분한 공연이었어,언니 사랑해 나 완전 녹색이야
1827,5,kdyoung1***예매자,2020.02.10,조회 41,공감 1공감하기,재연이,훨씬맘에들어요
1828,5,eec***예매자,2020.02.10,조회 37,공감 2공감하기,마리 퀴리,지난 시즌보다 한층 더 마리의 서사를 채워와서 좋았습니다
1829,5,ekgod***예매자,2020.02.10,조회 31,공감 0공감하기,,
1830,5,ansrudwl***예매자,2020.02.10,조회 36,공감 0공감하기,양승리 최고,양승리 최고
1831,5,myhy***예매자,2020.02.10,조회 43,공감 2공감하기,모든 분들이 꼭 한번은 봤으면 하는 작품,마리 퀴리의 일생을 잘 담아낸 작품입니다음악도 좋고 무대 구성도 다채로웠고 배우분들의 연기도 참 좋았어요김소향 배우와 이봄소리 배우의 눈물에 얼마나 감동받고 왔는지 모르겠네요다음엔 리사 배우님으로도 한번 더 보려고 해요
1832,4,jins***예매자,2020.02.10,조회 35,공감 0공감하기,좋았습니다,뮤지컬 마리퀴리가진짜 뮤지컬 마리퀴리가 되었네요달라진 뮤지컬 마리퀴리 감동적이고 재밌습니다
1833,5,qewooh***예매자,2020.02.10,조회 41,공감 0공감하기,자기 자신을 마주하고 또 그것을 넘어,억눌린 조국의 현실 차별 받는 여자의 신분 이런 외적인 억압과도덕과 절제를 상실한 과학에 대한 유혹그 속에서 자기 자신을 마주하고 그것을 반성하고 용서하고 화해하고 마침내 넘어서는 마리퀴리의 모습은과학의 영역을 넘어 심리학적이고 신화적인 어떤 영역에 닿는 것 같습니다승화 라는 말이 생각나는 군요좋은 연기를 보여준 배우님들 좋은 작품을 만들어준 스탭분들 모두 감사합니다
1834,5,siy***예매자,2020.02.10,조회 29,공감 0공감하기,,
1835,5,shfksr***예매자,2020.02.10,조회 51,공감 0공감하기,1막은다소루즈하나2막은 레전,많이울엇어요
1836,4,agap***예매자,2020.02.10,조회 44,공감 0공감하기,퀴리부인 아닌 마리퀴리,좋은 극이예요재연에서 수정도 많이 되었고 더 많은 분들이 보셨으면 좋겠습니다
1837,5,moon070***예매자,2020.02.10,조회 30,공감 0공감하기,,좋았습니다
1838,5,neo2***예매자,2020.02.10,조회 34,공감 0공감하기,너무 재밌어요,너무 재밌어요
1839,5,a9705***예매자,2020.02.10,조회 46,공감 0공감하기,와 내용라이브 후기,알차고 좋아
1840,5,a9705***예매자,2020.02.10,조회 45,공감 0공감하기,임별 미쳣,리사 임별 양승리 배우들 다 쩌러
1841,5,ylha***예매자,2020.02.10,조회 49,공감 0공감하기,가능성이 많은 극,난해한 부분도 재미가 떨어지는 부분도 있지만 마리퀴리라는 인물을 잘 다룬 극 아직 프리뷰 기간이라 수정이 가능하기에 조금만 더 다듬으면 좋을 듯 하다
1842,5,likelik***예매자,2020.02.10,조회 38,공감 0공감하기,뮤지컬 〈마리 퀴리〉,뮤지컬 〈마리 퀴리〉
1843,5,ib***예매자,2020.02.10,조회 35,공감 0공감하기,여성서사극 좋아요,여성서사극 좋아요
1844,4,kimseo***예매자,2020.02.10,조회 69,공감 0공감하기,1막만 좀 잘 수정됐으면,일막이 좀 지루해요이막은 좋은데일막 넘버를 빼고 대사로 쳐도 될 부분까지 다 넘버로 끌다보니 좀 지루합니다 인터미션 언제 되는지 한 여섯번 생각했어요
1845,4,shs8***예매자,2020.02.10,조회 42,공감 1공감하기,김찬호 짱,김찬호 +
1846,5,joonjoon1***예매자,2020.02.10,조회 26,공감 0공감하기,추천합니다,추천합니다
1847,5,sky981***예매자,2020.02.10,조회 35,공감 1공감하기,사랑해요 마리,마리 스클로도프스카 퀴리 마리의 이름을 이제야 말할 수 있게 되었다
1848,5,s03***예매자,2020.02.10,조회 24,공감 0공감하기,너무 잘 봤습니다,재미있어요 더 보고싶어요 너무 잘 봤습니다 너무 재미있네요
1849,5,s03***예매자,2020.02.10,조회 19,공감 0공감하기,좋았어요,어릴적 읽엇던 위인전 생각도나고 너무 잘 봤습니다
1850,5,toyp***예매자,2020.02.10,조회 23,공감 0공감하기,이 시대의 여성극,꼭 보세요두번 보세요갓극임
1851,5,shcj4***예매자,2020.02.10,조회 38,공감 1공감하기,마리안느당신들이 내 별이야라이브 후기,트라이아웃 때는 마리 퀴리라는 인물로 이것밖에 못 만들어 하고 정말 실망해서 표도 안 잡았었는데 첫공 열리고 주변 후기 보고 부랴부랴 잡아서 갔는데 이게 무슨 일 마리 안느당신들이 내 별이야
1852,5,heyyoun***예매자,2020.02.10,조회 29,공감 1공감하기,초연과 또다른 재미,새로운 캐스트와 연출과 의상 모두 좋았어요
1853,5,jjungg***예매자,2020.02.10,조회 31,공감 1공감하기,마리퀴리,초연보다 훨씬 좋아져서 돌아왔네요 보면서 눈물이 너무 났어요 정말 좋은 작품이에요 많은 사람들이 봤으면 좋겠어요
1854,5,kimj0***예매자,2020.02.10,조회 23,공감 0공감하기,마리퀴리,초연 때보다 훨씬 더 좋아요볼레로 넘버 가사만 좀 고치면 더 좋을 거 같아요
1855,5,kimchi***예매자,2020.02.10,조회 29,공감 1공감하기,마리퀴리,좋은 극이에요넘버도 좋고 인물들이 다 매력있어요꼭 한번 보셨으면좋겠어요
1856,3,bl***예매자,2020.02.10,조회 67,공감 1공감하기,마리 퀴리,기대를 허무는느슨함과 안이함
1857,5,ewk***예매자,2020.02.10,조회 25,공감 1공감하기,정말 좋네요,마리와 안느 관계가 풍성해지고 깊어지니 산실 때보다 훨씬 좋아졌어요다만 죽은 직공들의 볼레로에서 창녀보다도 매독이 아닌 걸 부정하는 쪽으로 가사가 좀 바뀌면 더 좋겠어요거기다 한 두세 군데 정도 노래 말고 대사로 그냥 치고 빠르게 넘어가도 될 것 같은 부분이 있는데 프리뷰니까 잘 수정되겠죠 창작진들을 믿습니다아무튼 공연이 너무 좋았어서 또 보러갈 것 같아요
1858,4,cld***예매자,2020.02.10,조회 36,공감 2공감하기,마리퀴리,소향마리는 최고다
1859,5,ace***예매자,2020.02.10,조회 20,공감 0공감하기,재밌었어요,1막은 좀 지루한 면이 있었지만 2막 너무 재밌었어요
1860,5,saahyan***예매자,2020.02.10,조회 17,공감 0공감하기,마리 퀴리,정인지 마리김히어라 안느임별 피에르양승리 루벤김아영 조쉬장민수 폴주다온 아멜리에조훈 마르친창작산실로 올라왔었나 그랬을 때 호평 보다는 혹평이 많았는데완전히 고치고 2시간 정도 되는 공연시간이 1막과 2막으로 나뉘어서 좀 더 길어졌다고 했다걱정이 되기도 하고 기대가 되기도 해서 첫공을 보러 갔다충무 블랙은 무엇보다 좋은 점이 중블에 앉으면 어디라도 좋다는 것이다3열4열이 제일 집중도 잘 되고 전체적으로 보기도 좋고다만 의자가 인체공학적으로 나랑 안 맞는지 등이 유난히 아프기는 한데중블만큼은 어디 앉아도 좋아서 더 많이 보게 되는 것 같기도 하다내용적으로는 우선 인지 배우의 마리가 엄청났다연기며 넘버며 세월의 흐름이며 모든 부분에서 감탄이 나왔다내용에서는 개인적으로 비슷한 환경에 있다 보니 흥미롭기도 하고감정이입이 심하게 돼서 화가 나기도 하고 그랬다이과여서 그랬는지 모르겠지만 굳이 이과든 문과든 과학적인 지식이 있든 없든크게 상관 없을 것 같긴 한데아무튼 좋아하는 배우가 원캐로 출연 중이라서 첫공을 보면서 참 떨렸는데걱정하지 않고 충분히 많이 봐도 좋을 것 같아서 다행이다
1861,4,llhesit***예매자,2020.02.09,조회 46,공감 1공감하기,김소향 배우님 만세,연기력 완벽 노래 완벽 정말 마리퀴리 그 자체였습니다
1862,5,joar1***예매자,2020.02.09,조회 33,공감 0공감하기,뮤지컬 마리퀴리라이브 후기,마리퀴리 위인을 뮤지컬로 잘 풀어담아낸 것 같아요 넘버들도 좋고 배우분들도 다 잘하셔서 좋았습니다 다른 페어로도 보러갈까 생각중입니다
1863,4,mi1k***예매자,2020.02.09,조회 58,공감 0공감하기,괜찮은 극이였어요,제목이 마리퀴리인 만큼 마리역의 비중이 엄청 큽니다 150분인 극에 내내 무대위에 올라와있는 마리역의 배우님들 정말 대단하네요 과학과 관련된 내용인 만큼 대사량도 많습니다 실험용 생쥐에 직공들을 비유하는 넘버나 주기율표의 칸에 배우들이 하나하나 들어가는 연출이 꾀 괜찮았습니다 다만 극장의 특성상 오케스트라 소리가 너무 커서 배우님들 목소리가 좀 묻혀버리는 느낌이 있어 아쉽습니다
1864,5,yly0***예매자,2020.02.09,조회 53,공감 2공감하기,마리퀴리는 갓극입니다,마리퀴리는 어릴때 위인전을 보면서 정말 멋진 사람이라고 생각했었는데 뮤지컬로 보니 더더욱 그렇게 느껴졌습니다 처음부터 울컥해서 끝까지 벅차올랐던 뮤지컬은 정말 오랜만이었어요 향마리의 시원한 고음을 들으니 더 벅차올라서 마지막엔 정말 많이 울었어요 또 보러갈거에요
1865,5,yks486***예매자,2020.02.09,조회 101,공감 3공감하기,그댄 내게 별,넘버 참 좋아요중블에서 다시 보겟어요
1866,5,ellenore***예매자,2020.02.09,조회 75,공감 1공감하기,식상한 표현이지만 정말 감명깊게 봤습니다라이브 후기,첫 장면부터 가슴 뭉클하게 시작하더니 2부에선 내내 눈물을 멈출 수 없게 하네요 마리 퀴리의 그 무거웠던 삶의 무게와 슬픔이 느껴졌습니다 훌륭한 동반자의 모습을 따뜻하게 보여주신 임별님 나쁜 캐릭을 못되게 잘해주셔서 미웠는데 커튼콜하실 때 눈가가 촉촉하시던 양승리님 줄리앤폴과 또 다른 매력을 보여주신 김아영님 맑은 목소리가 역할에 어울리시던 주다은님 엉뚱맞은 캐릭이 잘 어울리시던 장민수님 훈훈하게 역할을 소화해주시던 조훈님 맑은 영혼을 가진 안느역이 정말 잘 어울리던 김히어라님 무엇보다 너무나 훌륭하게 마리를 연기해주신 제가 정말 좋아하는 리사님 프리뷰는 어딘가 모르게 합이 안 맞는 모습이 좀 보일 수 밖에 없는데 막공보는 듯한 공연에 얼마나 연습하셨는지 가늠이 안되네요 다들 최고십니다
1867,5,cwyh4***예매자,2020.02.09,조회 66,공감 2공감하기,최고의 공연라이브 후기,리사 마리 최고입니다  공연 막바지에는 엄청 많이 울었네요
1868,5,tiny8***예매자,2020.02.09,조회 72,공감 1공감하기,상반기 최고의 작품,보면서 정말 많이 울었습니다
1869,5,imjeo***예매자,2020.02.09,조회 73,공감 0공감하기,뮤지컬 〈마리 퀴리〉,굉장히 교육적이면서도 착한 연극 같은 뮤지컬많이들 보면 좋겠어요
1870,5,yje***예매자,2020.02.09,조회 75,공감 0공감하기,공연 잘 봤습니다,공연 잘 봤습니다
1871,5,lshm***예매자,2020.02.09,조회 105,공감 3공감하기,향마리 진짜 최고,마리장인
1872,4,han24***예매자,2020.02.09,조회 93,공감 1공감하기,잘 봤습니다,지루한 면도 있었지만 마리-안느 서사가 참 좋았어요 안무 중에 라듐중독 증상을 표현하는 것도 좋았고요 기회되면 3월에 임별피에르로 한 번 더 보려고요
1873,4,wjs4***예매자,2020.02.08,조회 143,공감 1공감하기,공부하고 본 뮤지컬라이브 후기,3번쨰로 본 뮤지컬 <마리 퀴리> 초연은 못봤지만 드디어 본 마리퀴리 재미있어요 또 보로 올게요 
1874,5,eun2***예매자,2020.02.08,조회 303,공감 4공감하기,보고 난후라이브 후기,초연때랑 너무 달라지만 재미 있었음역시 소향마리 답네요막공때 다시 보려고요
1875,5,a66331***예매자,2020.02.08,조회 197,공감 1공감하기,첫 공연,첫 공연에 이렇게 눈물 훔치기 있나요너무너무 좋은 극이 었어요 안보는 사람 없길 바랍니다&128591;&127995;
1876,5,lsr***예매자,2020.02.08,조회 307,공감 2공감하기,인지마리 최고라이브 후기,인지배우님 최곱니다꼭 한번보세요 아니 여러번 보세요
1877,5,gsm0***예매자,2021.04.10,조회 24,공감 0공감하기,믿고보는 옥느님,믿고보는 옥느님
1878,5,heu03***예매자,2021.02.02,조회 29,공감 0공감하기,김히어라 이봄소리,세상을 씩씩하게 살아가는 사람들에너지넘치는 모습뒤에 얼마나 부딪히느일들이 많았을지 난 감히 상상할수없다많이 부딪혔기에 더 씩씩하게 연기할 수 있는것같다벅차고 떨리고 통쾌해
1879,5,heu03***예매자,2021.02.02,조회 24,공감 0공감하기,세상은 알수없는것들로 가득차있어,모든것들의지도공연을 안본지 오래되었지만 여전히 기분이 이상한작품내 마음이 솔직해질수 있는 순간다 할수 있을까 길이 멀고멀어 날가로막는 것들 온몸으로 부딪혀
1880,5,miracleco***예매자,2020.12.14,조회 37,공감 0공감하기,옥마리보러갓다가 별배우에게 치인날,마리퀴리에 대해 잘 알지도 못햇던 나를 질책함옥주현배우는 말할것도 없엇지만 임별배우 넘나 멋졋다적은 수의 배우들로 꽉찬 무대였다
1881,5,miracleco***예매자,2020.12.14,조회 16,공감 0공감하기,옥마리보러갓다가 별배우에게 치인날,마리퀴리에 대해 잘 알지도 못햇던 나를 질책함옥주현배우는 말할것도 없엇지만 임별배우 넘나 멋졋다
1882,5,1221***예매자,2020.10.27,조회 17,공감 0공감하기,옥마리 쵝오,너무너무 좋은 공연이었어요
1883,5,tlsdo0***예매자,2020.10.25,조회 14,공감 0공감하기,믿고봤던 공연,내용은 살짝 지루햇지만 옥배우 믿고 가서 잘봣습니당
1884,5,hyolee***예매자,2020.10.23,조회 11,공감 0공감하기,믿고보는 옥배우,최고의뮤지컬
1885,5,wlsthf1***예매자,2020.10.19,조회 15,공감 0공감하기,진짜 최고의 뮤지컬,너무 좋아요
1886,5,wodls0***예매자,2020.10.18,조회 23,공감 0공감하기,마리 스클로도브스카 퀴리,두 번째 볼 때는 직공들에게 집중해서 봤는데 정말 슬프고 여운이 남는 극이었어요
1887,5,wodls0***예매자,2020.10.18,조회 16,공감 0공감하기,마리퀴리 자첫,인터 시간에 자둘 표 잡으러 갈 만큼 너무 인생극 마리와 안느가 잊히지 않을 것 같아요
1888,3,hanjy0***예매자,2020.10.17,조회 14,공감 0공감하기,재밌어요,오랜만에 뮤지컬 봤는데 마리퀴리 봐서 좋았습니다
1889,5,yotiee1***예매자,2020.10.16,조회 18,공감 0공감하기,마리퀴리 덕분에 행복한 여름이였습니다,계절이 바뀌었지만 아직까지 마리퀴리 생각하면 가슴이 뜨거워져요 감사했어요
1890,5,yotiee1***예매자,2020.10.16,조회 24,공감 0공감하기,한달이 되어가지만,아직 넘버를 흥얼거리고  딥디 기다려요 
1891,5,vpoo***예매자,2020.10.12,조회 14,공감 0공감하기,마리퀴리 넘버가 자꾸 생각나요,다음엔 꼭 음향 좋고 단차 좋은 극장에서 상식있는 좌석배치도를 가지고 앙상블 23명 정도 추가해서 왔으면 좋겠습니다
1892,4,sunni4***예매자,2020.10.12,조회 17,공감 0공감하기,마리퀴리 소향,그냥 대명사 아닐까요
1893,5,onewb***예매자,2020.10.12,조회 15,공감 0공감하기,김소향 배우님,진짜 너무 잘하셔서 공연시간 내내 너무 행복했어요
1894,5,ekdr***예매자,2020.10.12,조회 17,공감 0공감하기,이런 극은 또 올라와야합니다,더 자주 올라오길
1895,5,pachris***예매자,2020.10.12,조회 21,공감 0공감하기,김소향배우님은마리장인이십니다,총막 공연 너무 대단했습니다 김소향 배우님 무대인사 듣고 눈물 났어요여러가지 이유가 있었겠지만 타이밍이 너무 안좋았던 같네요 나중에 꼭 다시 돌아와줘요 홍아센말고
1896,5,Princessji***예매자,2020.10.11,조회 13,공감 0공감하기,완전 짱,마리퀴리 너무 좋았어요근데 엽서를 못 받았어요사람이 많아서 그런지 아무말도 안해주셔서 어디서 받는지 몰랐어요
1897,5,osm6***예매자,2020.10.11,조회 10,공감 0공감하기,나의 별 폴란드의 별,오슷딥디 주세요 이 갓극을 그냥 보내버릴 수 없어요
1898,5,leebel***예매자,2020.10.11,조회 12,공감 0공감하기,삼연에도 향마리,꼭 모셔와주세요 향마리가 다했다마리 장인이라는 것이 괜히 나온 말이 아니었습니다정말 최고였어요
1899,5,taehee1***예매자,2020.10.11,조회 13,공감 0공감하기,향마리,사랑해요
1900,5,taehee1***예매자,2020.10.11,조회 10,공감 0공감하기,향마리,보고싶어요
1901,5,js1***예매자,2020.10.10,조회 21,공감 0공감하기,공연이 끝나도 보고싶은 마리퀴리,마지막 공연 한지 2주가 되었는데 아직도 문득문득 마리퀴리가 그리워집니다
1902,5,bogyung***예매자,2020.10.10,조회 13,공감 0공감하기,옥마리,페어막공으로 자막했어요 헛헛하네요 옥마리 다음에도 꼭 오길
1903,5,bogyung***예매자,2020.10.10,조회 5,공감 0공감하기,총막날이 다가오는게 너무 아쉽네요,홍아센이긴 했지만 이번에 너무 잘봤습니다 곧 돌아오길
1904,5,zhzhdk1***예매자,2020.10.10,조회 8,공감 0공감하기,마리퀴리,재연으로 와서 보게되었는데 보통 어렸을때느 퀴리부인이라고 하면서 뮤지컬을 보면서 위인을 알아가는 것과 무슨일들을 했는지 알게 되어 삼연으로 또오면 좋겠어요
1905,5,hae***예매자,2020.10.08,조회 5,공감 0공감하기,최고에요,꼭 봐야하는 뮤지컬입니다 배우님들 연기가 너무 좋아서 몰입해서 봤네요
1906,4,ugh1***예매자,2020.10.08,조회 6,공감 0공감하기,굿,옥마리 너무 좋았어요
1907,5,nag***예매자,2020.10.08,조회 17,공감 0공감하기,최고였어요,다음에 올라오면 또 보러갈게요 총막까지 힘내셨습니다
1908,5,nhj***예매자,2020.10.08,조회 9,공감 0공감하기,고민하다가 갔지만,최고였다
1909,5,red***예매자,2020.10.07,조회 17,공감 1공감하기,애썼어 마리,세상의 모둔 마리와 안느들의 애씀에 감사하게 되었어요
1910,5,vivajin***예매자,2020.10.07,조회 6,공감 0공감하기,감동적인 공연,극장도 깨끗하고 방역도 잘 되어있더라고요이벤트 선물로 악보도 받았습니다뮤지컬 내용도 마리퀴리의 일생을 다룬 작품인데그 고뇌가 고스란히 전해져오고 배우들 연기가 정말 좋았습니다옥주현마리 임별피에르 둘의 부부케미도 참 좋고요직공들 앙상블 연기도 좋았습니다 또 보러가고싶은데 이미 막을 내려서다음번에 한다면 극 초반에 예매 할래요
1911,5,wntnwls***예매자,2020.10.07,조회 6,공감 0공감하기,마리퀴리,삼연 기다릴게요 항상 좋은 공연 감사합니다
