,Rating,Id,Date,views,like,Title,Text
2682,5,rlakfn5***예매자,2020.09.02,조회 152,공감 3공감하기,진짜 인생 뮤지컬 최고의 뮤지컬 마리퀴리 진짜진짜진짜 나의 별임,마리퀴리 옛날에 실황할 때는 별 생각 없었는데 다시 보고나서 마리퀴리에 푹 빠져버렸어요저번에 본 회차에서는 옥주현 배우님으로 봤어서 김소향 배우님 너무 궁금했었는데 정말 정말 300% 만족 상대적으로 더 여려보이지만 굳건하게 해야 할 일을 해나가는 모습이 너무 좋았어요 보는 내내 울컥 처음에 기차 소리 덜커덕덜커덕하고나서 세상은 알 수 없는 것들로 가득차 있어 할때부터 왈칵 눈물버튼 눌린 것 처럼 한 소절 하실때마다 너무 장하고 대단하고 멋있고 아무튼 넘 보는 내내 응원하고 있었습니다 커튼콜때 그댄 나의 별 에서 손가락으로 별모양 그려주시는데 아 너무 최고다최고다김히어라 배우님은 그저사랑 그저 사랑 후반부는 안느랑 직공들만 보면 눈물 펑펑나서 힘들었어요 마지막에 커튼콜에서 루벤한테 주먹 날리는척하다가 와락 안아주고 가시는데 너무 귀여웟임별 배우님 다른 작품에서 먼저 보면서 목소리 정말 멋지셔서아 진심 취향저격 평생 연기하고 노래해주세요 제발제발제발 믿고 고른 캐스팅이었는데 마리퀴리를 보기 전까지는 신뢰의 픽이었다면 이제는 무조건 임별 피에르 역할 너무 잘 어울려요 마리퀴리가 다음에 올 때에도 임별 배우님 피에르 만나고 싶어요 극 중간에 직공들 장면 뒤에서 피에르가 바브카 향 맡는 척하니까 마리가 머리 꾹 눌러서 바브카에 코박게 했더니 코 슥슥 문지르면서 둘이 씨익 웃는거 보면서 심장 멈췄잖아요그저 사랑했다그들은 사랑했다 커튼콜때도 마리 나올때만 손키스 날리는거 보면서 머리 새하얘지면서 박수쳤잖아요 아 대박 사랑했다 퀴리 부부양승리 배우님도 어쩜 딕션이 그렇게 최고인지 들을 때마다 감탄만 라듐파라다이스때 이리로와요 하는데 무대난입해도 이거는 어쩔수없는겁니다 물론 난입하지 않았습니다 근데 진짜 사람을 막 홀리잖아요 라듐이 기다리고있다 조쉬랑 이렌 김아영 배우님으로 봤었는데 둘 다 너무 좋았지만 마지막에 이렌으로 마리의 죽음을 발표할 때 눈물 펑펑 배우님은 담담하게 말하시는데 저는 눈물 펑펑폴 베타니와 병원장 이상운 배우님 폴일때 자꾸 폴 나대지마하는거 너무 웃겨서 자꾸 눈에 들어왔어요 밝게 장난치던 사람이 무너지니까 그냥 제 마음도 같이 무너진다아멜리에와 루이스 서혜원 배우님 저 루이스 사랑하잖아요 루이스 눈 뜨게 돼서 너무 기쁘다 루이스와 마리 첫 만남에서 점점 신뢰를 가져가는 모습 정말 좋아하는데 역시 맨 처음에 앙칼지게 그럼 그냥 가시든가 외치는거 최고-마르틴그리고 닥터샤갈 마르탱 직공들중에 마르틴이 제일 좋은데 이유는 모르겠고 그냥 좋아요 지금까지 두 번 봤는데 다 송상훈 배우님으로 봤어서 친근혼자 빵모자 쓰고 있는거 너무 귀여운데 직공들을 위한 볼레로 때 모자 집어 던지는 장면때 같이 분노하면서도 모자 귀여운 모자 이러고 있었어요알리샤 바웬사 이윤선 배우님 마찬가지로 직공들을 위한 볼레로 알리샤 바웬사 하는 목소리 왜이렇게 잘 들리는지 직공들 중에는 이름 제일 먼저 외웠었어요 목소리 너무 좋다아 사실 라듐 파라다이스때도 목소리 대바악 하고있었는데 나중에 보니까 같은 분이더라구요레흐 노바크 이찬렬 배우님 정말 이번에 보면서 엄청 눈에 띄어서 좋았어요 뭐라고 말해야되지아무튼 진짜 좋았는데 그 뭐냐 블랙 미스 폴란드때도 라듐 파라다이스때도 다 좋았는데 그 제목 뭐지 쥐들 쥐들 쥐 실험할 때 제 바로 앞에서 초 기합소리 내시고 가셨는데 그게 왤케 좋았는지 자꾸 생각나요 보러 갈 때마다 레흐 노바크로 있어주셔서 너무 좋습니다 다음 관람때 또 보면 혼자 내적 친밀감 맥스아 그리고 라이브 라이브 창문창문 그림자 이용하는거 왜이렇게 좋아하시는지   창문 볼때마다 눈물 펑펑 진짜너무좋으니까 랑 도 내주시면 안될까요 제발제발 뮤지컬에 이렇게 진심인적 없었는데 어떻게 이럴수가 그리구 다음에도 임별 배우님꼭 아 저 진짜 진심임 다 샀단말입니다 선물용도 샀다구요 랑 도 돈은 이미 준비 되어있으니까요 
2683,5,junk1***예매자,2020.09.01,조회 50,공감 0공감하기,재밌어요,잘봤습니다
2684,5,juhee3***예매자,2020.09.01,조회 60,공감 2공감하기,너무 감동적입니다,비록 극적인 요소가 가미되긴 했지만 사회적 배경과 함께 여성 과학자로써 겪었던 마리퀴리의 희노애락가득한 삶을 뮤지컬로 볼 수 있어 매우 감동적이었습니다 특히 옥주현 배우의 연기와 노래가 너무 인상 깊어서 팬이 되었어요 코로나 시국에 취소할까 고민 많이했는데 반 이상 비어버린 객석에서도 열연하며 고생하는 배우들을 보니 보길 잘했다는 생각이 듭니다 관람하기 전 꼭 자가진단 해서 몸이 조금이라도 좋지 않으면 아쉽지만 다음을 기약하시고 관람하시는 분들은 마스크 및 소독 철저히 하셔서 좋은 작품을 많은 분들이 봤으면 합니다
2685,5,staryu***예매자,2020.09.01,조회 102,공감 2공감하기,향마리 히어라안느 너무 좋았어요,코로나 때문에 사실 저도 취소할까 말까 고민하다 보러간거긴 하지만 빈 자리가 많아 보여서 마음이 아팠습니다 객석 빈자리와 상관없이 열연해주신 배우님들 너무 멋졌고 명불허전 소향배우님 짱이었어요극 시작시간 아슬아슬하게 도착했고 극 끝난 후에는 운영을 안 해서 자세히 볼 시간은 없었지만 옆에 갤러리 형태로 전시회 구성해 두신 것도 좋았습니다
2686,5,whyi***예매자,2020.08.31,조회 51,공감 0공감하기,항상 좋아요,배우님들 너무 잘하셔요재밌게 봤어요
2687,5,ty1***예매자,2020.08.31,조회 46,공감 0공감하기,좋은 공연입니다,좋은 공연입니다재미있어요강추합니다
2688,5,bluerntmf***예매자,2020.08.31,조회 71,공감 0공감하기,옥주현 배우님 감사합니다,좋은 공연 마음에 담고 내려가요감사합니다
2689,5,bluerntmf***예매자,2020.08.31,조회 60,공감 0공감하기,옥마리 최고에요,옥마리를 볼 수 있어서 너무 행복했어요감사합니다
2690,5,pooh9***,2020.08.31,조회 45,공감 0공감하기,너무 좋은 작품,마리퀴리 덕분에 큰힘을 얻었네요 너무 감동적이고 좋았어요
2691,4,sjeongmi***예매자,2020.08.31,조회 66,공감 0공감하기,재밌어요,옥주현 배우님 캐스트로 관람했어요옥배우님 작품은 처음 보는거라서 기대 많이 했는데 역시 좋더라구요1막부터 울었네요 내용이 안타깝고 슬프고 그래요2막때는 거의 눈물 콧물 다 흘렸어요 마스크 내리면 안되서 닦기도 애매하고 참 난감했네요 
2692,5,puri***예매자,2020.08.31,조회 33,공감 0공감하기,좋아여,좋아여
2693,5,tricky0***예매자,2020.08.31,조회 34,공감 0공감하기,그댄 나의 별,가사가 곱씹을수록 너무 좋네요 두 사람의 관계성도요 
2694,5,tjb***예매자,2020.08.31,조회 19,공감 0공감하기,재밌었어요,좋은 공연 잘 봤습니다
2695,5,kye0***예매자,2020.08.31,조회 17,공감 0공감하기,잘 봤습니다,끝까지 무사히 공연이 잘 올라오길 바래요 
2696,4,diana3***예매자,2020.08.31,조회 31,공감 0공감하기,엄청신나는 컬,재밋어요
2697,5,daybrea***예매자,2020.08.31,조회 20,공감 0공감하기,마리퀴리,마리퀴리마리퀴리마리퀴리마리퀴리마리퀴리마리퀴리마리퀴리마리퀴리
2698,5,upsilon***예매자,2020.08.31,조회 18,공감 0공감하기,강추 또 강추,역시 향마리 찐이예요
2699,5,honghj***예매자,2020.08.31,조회 27,공감 0공감하기,재밋엇어요,기대됩니다
2700,5,shm4***예매자,2020.08.31,조회 24,공감 0공감하기,행복한 관극,마음 속에서 열정이 우러나는 극이었습니다
2701,4,gennar***예매자,2020.08.31,조회 60,공감 0공감하기,넘버가 임팩트 있지않았지만 연기로 충분히 감동을 주는뮤지컬,자극적이고 볼거리에 치중한 뮤지컬을 많이 봐왔더니1막은 좀 지루했어요 노래도 크게 임팩트있지 않았구요그런데 2막 들어서면서 배우들의 연기와 캐릭터의 서사가 휘몰아치더군요 마지막 장면에서는 정말 눈물을 흘리지 않을 수가 없었어요
2702,3,hyeni***예매자,2020.08.31,조회 55,공감 0공감하기,지루한 감이 없지않아 있는데,배우들이 너무 잘해서 집중하게 돼요
2703,5,cla***예매자,2020.08.31,조회 19,공감 0공감하기,너무 좋아서 두번째 보러왔어요,배우도 무대도 조명도 너무 좋아요
2704,5,realyoung1***예매자,2020.08.31,조회 16,공감 0공감하기,좋았어요,배우들이 잘해요
2705,5,khk120***예매자,2020.08.31,조회 17,공감 0공감하기,좋았어요,정말 감동적인 여성 서사 너무 잘봤습니다 행복한 시간이었어요
2706,5,tjsrud1***예매자,2020.08.31,조회 18,공감 0공감하기,좋은 공연 감사합니다,힘든 시기에 멋진 공연 감사합니다 열연을 펼쳐주신 배우님들 제작진들 스텝님들 모두에게 정말 감사드립니다
2707,5,chzhgnl***예매자,2020.08.31,조회 33,공감 1공감하기,퀴리부인이 아니라,퀴리부인이 아니라 그냥 마리 퀴리
2708,5,garden***예매자,2020.08.31,조회 20,공감 0공감하기,마리 스클로도프스카 퀴리,누군가 뮤지컬 딱 하나만 추천해 달라고 부탁한다면 주저없이 말할 수 있는 뮤지컬
2709,5,garden***예매자,2020.08.31,조회 17,공감 0공감하기,행복한 시간,라듐보다 더 밝게 빛나는 배우님들을 볼 수 있어 행복했습니다
2710,5,garden***예매자,2020.08.31,조회 19,공감 0공감하기,의미있는 극,그 어느 뮤지컬보다 가장 와닿고 뭉클한 극이었어요
2711,4,myconti***예매자,2020.08.31,조회 12,공감 0공감하기,마리,마리는 최선을 다한거죠볼때마다 슬퍼
2712,4,frien***예매자,2020.08.31,조회 16,공감 1공감하기,지독했던 고독했던 그녀의 인생,지독했고 고독했던 인생이라고 생각합니다대단하다는 의미로 지독하다고 얘기하고 싶어요저라면 절대 견디지 못했을 것 같거든요배우들의 열연이 있어서 이 작품을 더욱 집중하면서 볼 수 있었던 것 같습니다옥주현 배우가 어떤 생각에서 이 작품을 택했을지도 알 것 같구요그래서인지 더욱 진심과 진정으로 작품에 임하고 있는 것을 느낄 수 있습니다김히어라 배우는 실력이 점점 늘어가는 것 같아요안나를 응원하고 지지하게 되는 힘을 끌어내는 연기였다고 생각합니다임별 배우는 정말 목소리에 반했습니다김찬호 배우 김아영 배우 장민수 배우 주다온 배우 송상훈 배우까지모든 배우들에게 박수를 보냅니다어려운 시기에 무대와 객석 모든 곳이 최선을 다하고 있는 만큼끝까지 완주하여 무탈하게 공연 마무리하기를 응원합니다
2713,5,gksmf***예매자,2020.08.31,조회 8,공감 0공감하기,재밌게 잘보고 왔어요,잘보고나왔습니다 마리의 이야기를 보아서 좋았어요
2714,4,mik0***예매자,2020.08.31,조회 6,공감 0공감하기,재밌네요,감사합니다
2715,5,gksmf***예매자,2020.08.31,조회 14,공감 0공감하기,엄청 울고 나왔어요,몇달전 사랑했던 공연을 이렇게 빨리 볼줄 몰랐는데 다시 만나도 너무 행복했던 시간이었어요
2716,4,yeona***,2020.08.31,조회 9,공감 0공감하기,재밌어요,최고네요
2717,5,ti45m***예매자,2020.08.31,조회 8,공감 0공감하기,잘봤습니다,잘봤습니다
2718,5,lue***예매자,2020.08.31,조회 9,공감 0공감하기,최고였어요라이브 후기,정말 좋아하는 작품이에요
2719,5,kas***예매자,2020.08.31,조회 11,공감 0공감하기,김찬호 짱,찬루벤 짱짱
2720,5,lue***예매자,2020.08.31,조회 10,공감 0공감하기,매번 정말 많은 위로와 용기를 얻어요,감사합니다
2721,5,naonot***예매자,2020.08.31,조회 9,공감 0공감하기,이 매혹적이고 흥미진진한,뮤지컬 정말 좋았어요
2722,5,hanawesom***예매자,2020.08.31,조회 12,공감 0공감하기,예측맆에서 안우는법 모릅니다,또 울고 나왔네요 이봄소리 사랑해
2723,5,bor***예매자,2020.08.31,조회 12,공감 0공감하기,향마리 ,향마리 최고에요 
2724,5,mog0***예매자,2020.08.31,조회 11,공감 1공감하기,마리퀴리,향마리 봄안느 너무너무 최고였어요시기때문에 사람이 많이 없어서 너무 안타까웠네요
2725,4,shs8***예매자,2020.08.31,조회 11,공감 0공감하기,김찬호 최고,감찬호 짱
2726,5,lldoror***예매자,2020.08.31,조회 8,공감 0공감하기,재밌었어요,잘봤습니다
2727,5,ljy9***예매자,2020.08.31,조회 9,공감 0공감하기,잘 보았습니다,초연부터 본 사람입니다 코로나로 취소되는 이 와중에 무대 지켜주는 배우님들께 감사의 의사 보냅니다 옥주현 배우님 성량 죽입니다 꼭 보세요
2728,5,yeres***예매자,2020.08.31,조회 9,공감 1공감하기,마리퀴리,여태까지 열린회차중 딱 두번있었던 제 최애페어날이네요 김소향배우님의 마리는 정말 최고에요
2729,5,dasol0***예매자,2020.08.31,조회 13,공감 0공감하기,무언가에 온 몸이 들끓어,네이버티비 마리퀴리 중계를 우연히 보고난 후로바로 티켓예매해서 보러 갔습니다여성 주인공 서사인 극이라는 점과 탄탄한 스토리그리고 좋은 넘버들이 직접 가지 않고서는 안되겠더라구요마침 광복절 이후 코로나가 급격히 확산된 터라취소되는 공연이 많아 전날까지도 취소될까 조마조마했는데다행히 취소되지 않아서 조심스레 다녀왔어요옥주현 배우님 실제로 본 게 처음인데다들 이래서 옥주현 하는구나 싶더라고요물론 이봄소리배우와 여러 배우들의 연기도 무척 훌륭했어요넘버중에 예측할 수 없고 알려지지 않은과 그댄 내게 별이정말 최고였어요  집에 와서도 유튜브로 무한 재생중얼른 음원 나오길 바랄 뿐입니다올해 최고의 뮤지컬이 되지않을까 싶어요
2730,5,yyhu***예매자,2020.08.31,조회 7,공감 0공감하기,재미있어요,재미있게 보고왔어요
2731,5,dbdlwhdk***예매자,2020.08.31,조회 6,공감 0공감하기,재밌어여,재밌어여
2732,5,lseoyeo***예매자,2020.08.31,조회 7,공감 0공감하기,마리퀴리,좋아요
2733,5,loved***예매자,2020.08.31,조회 5,공감 0공감하기,재밌어요,재밌어요
2734,5,widms2***예매자,2020.08.30,조회 12,공감 0공감하기,감동적이에요,내용은 대강 알고 있어서그렇게 슬프지 않을 줄 알았는데엉엉 울었네요 잘보고 왔습니다
2735,5,widms2***예매자,2020.08.30,조회 12,공감 0공감하기,눈물이,트아로 처음 보고 약간 실망한 부분도 있었는데저번 시즌에는 못봤고 이번 시즌에 처음 봤어요근데 훨씬 좋아져서 돌아왔더라구요마스크 젖을까봐 눈물은 참았는데 그래도 눈가가 촉촉해졌어요배우님들의 연기도 감동적이었습니다다음에 기회가 된다면 또 보러가고싶어요
2736,4,hyun***예매자,2020.08.30,조회 14,공감 0공감하기,좋았어요,좋았어요
2737,5,taehee1***예매자,2020.08.30,조회 20,공감 0공감하기,사랑해요 향마리,오프닝 넘버부터 눈물 호도독 흘리시는 배우님항상 무대에 설 때마다 진심 가득 담긴 모습을 보여주시는데마리퀴리 하실 때 그게 가장 눈에 띄어요좋은 공연 너무 감사합니다
2738,5,taehee1***예매자,2020.08.30,조회 17,공감 0공감하기,향마리가 진리,평생 마리퀴리 길 걸어주세요 제발요펑펑 울다가 왔습니다 사랑해요 향마리
2739,5,1221***예매자,2020.08.30,조회 22,공감 0공감하기,옥마리 말이 필요없잖아요,정말 눈감빡하는게 아까울 정도로 집중하면서 관람했어요너무 좋았습니다
2740,5,funic***예매자,2020.08.30,조회 36,공감 1공감하기,다시봐도 감동적인 공연이였습니다,올해초 공연도 참 좋았었는데 이번 공연도 여전히 감동적이고 좋았습니다 배우님들 연기도 너무 좋았어요
2741,5,tkddk1***예매자,2020.08.30,조회 34,공감 0공감하기,뮤지컬 〈마리 퀴리〉,마리와 안느의 우정을 몇번을 봐도 눈물이 나요
2742,3,tooi***예매자,2020.08.30,조회 65,공감 1공감하기,대극장으로 옮기며,그렇지않아도 늘어지던 극이 더 루즈해졌네요 단점도 더 눈에 띄거 바뀐넘버들도너무 갑작스러워요 루이스에게 불러주는 넘버
2743,5,kimmi5***,2020.08.30,조회 32,공감 0공감하기,재관 필수,재미있습니다
2744,5,syyh***예매자,2020.08.29,조회 47,공감 0공감하기,꼭 추천 드립니다,뮤지컬을 본지 얼마안됬지만 여자가 주인공이며1박 2막 루즈함 없이 진행되는 공연이라 좋았습니다
2745,3,ellys***예매자,2020.08.28,조회 99,공감 0공감하기,마리퀴리라이브 후기,진짜 마리퀴리 인생은 충분히 극적이었는데 왜 이렇게까지 굳이 감상적으로 바꾼거죠 배우님들 무대 잘 봤는데 진부한 부분도 심심한 부분이 많고 솔직히 말해서 다시 보고싶은 마음이 없어요
2746,5,cla***예매자,2020.08.28,조회 52,공감 0공감하기,최고,역시 옥주현이다 + 무대 너무 예쁘고 조명 연출도 재밌게 잘봤어요
2747,5,choihu***예매자,2020.08.28,조회 77,공감 0공감하기,애썼어 마리 참 충분한 삶이었어,올 해 초에 올라왔을 때 코로나 때문에 아쉽게도 못 보게 돼서이번 시즌 공연에 대한 기대감이 정말 컸어요 제가 좋아하는 옥주현 배우님이 새로 합류하고 김찬호 배우님도 함께 하신다고 해서 두 배우님이 같이 나오는 회차를 예매해서 보고 왔습니다 홍아센 대극장을 혼자만의 연기와 목소리로 꽉 채우는 옥마리를 보며 소름이 돋아 괜히 팔도 쓱쓱 문질러보고 그랬네요 마리퀴리를 통해 처음 보는 이봄소리 배우님이 연기하시는 안느도 정말 좋았어요 연기도 노래도 흠 잡을 곳이 하나 없었습니다 제가 트라이아웃 초연을 보지 못해 달라진 구석을 짚어내진 못하겠지만 정말 좋은 극이라고 말 할 수는 있어요 마담퀴리 퀴리부인이 아닌 마리 스클로도프스카의 삶이 어땠는지 말해주는 뮤지컬이라 더 좋았던 것 같습니다 이렇게 모두가 힘들고 어려운 시간을 보내고있음에도 불구하고 작지 않은 극장을 꽉꽉 채워준 관객들을 보니 배우도 아닌데 울컥하더라고요 커튼콜 때 배우들끼리 서로 손을 꼭 붙잡고 그댄 내게 별을 부를 땐 정말 말로 형용할 수 없는 큰 위로를 받는 기분이었습니다 힘든 시기에도 이렇게 좋은 공연을 보여주시는 배우님들 이런 공연을 올릴 수 있게 도움 주시는 모든 스탭분들 그리고 극장 어셔분들떼 정말 감사하다는 말씀 드리고 싶어요 많이들 보러 가셔서 배우들과 스탭들에게 힘을 실어주세요
2748,5,dhrald***예매자,2020.08.28,조회 81,공감 0공감하기,뮤지컬 마리퀴리 옥주현은 완벽 김히어라 박영수 김찬호,너무 멋진 극이고배우분들이 출중 그 이상인데코로나로 인해 공연장은 꽤나 한산했고석 자리도 은근 공백이 보여서 너무나 안타까운 맘을 금할길이 없었답니다또 반대로 요새 배우분들 엔 마스크 쓴 관객들 무대에서 보면 울컥한다고 그러더라구요 우리 서로 짠해 하면서  울고 불고 빨리 코로나가 물러가면 좋겠단 마음 뿐이네요 요즘은자자 다시 마리퀴리 뮤지컬 얘기로 돌아와서명석한 두뇌와 과학쪽에 재능을 가지고 있었던 마리는그 어렵다는 프랑스 소르본 대학의 입학길에 오르면서같은 폴란드인인 안느를 만나게 됩니다약소국민이자 같은 여성의 몸으로 동병상련이랄까 더 마음을 나누며 대화하게 되는데요곧 둘은 친구가 됩니다 기차를 함께 타고 오며 안느는 마리의 꿈을 응원하구요그녀들의 만남 만큼이나 마리가 피에르퀴리를 만나는 장면도 재밌어요피에르퀴리를 박영수배우가 연기한 것도 참 잘 어울린다고 생각되요 피에르퀴리가 실제론 어떤 성향의 사람이었을지는 잘 모르지만이 극에서 그려지는 그리고 마리퀴리와 같은 과학자로서아내를 외조하는 남편이자 동반자 협력자 친구로서박영수 배우가 보여주는 그런 이미지 가 제대로일꺼 같아요 폴란드인 여성으로 프랑스 대학에 와서 자신의 꿈을 당차게 펼치는 것도 그렇고매사에 씩씩한것도 그렇고 옥주현 배우도 마리퀴리로 찰떡이었답니다과학자 대사를 치는것도 흡사 정말 그녀는 그런 이론들을 알고 중얼거리는것처럼연기도 어찌나 잘하는지+_+그녀의 목청은 이제 뭐 말하면 입이 아플정도너무나 잘어울리고 완벽하게 잘해내는 배우라 언제나 관객들을 200프로 만족시키조조금만 더더 하며 연구에 매진 하는 모습그리고 노벨상을 피에르퀴리와 공동수상 하는 모습나중에 라듐의 폐해가 하나둘 드러나기 시작했을때 고뇌하고 괴로워하는 모습자신의 딸에게 애지중지 하는 흙주머니에 대해 얘기해주는 할머니 마리퀴리의 모습등등어느것하나 아쉬움 한점 없는 연기의 퍼펙트를 보여주는 옥마리김히어라 배우는 또 어떻구요보도지침에서 너무나 인상깊게 본 배우인데뮤지컬 마리퀴리에선 안느 코발스키 그 자체였네요영민함이 묻어나는 그 눈빛과 김히어라 특유의 음색이이 배우는 정말 어디서든 빛이 날껏 같습니다그녀가 나이들어서도 마리에게 편지를 보내는 장면이 나오는데그녀의 모습이 저도 궁금할 정도로 그리움을 자아내는 무대였답니다  개오열&8203;공연을 통해서 얻게 되는게 참 많습니다우리가 무늬만 잘알고 있던 퀴리부인- 마리퀴리의 삶과또한 그녀의 고뇌 그리고 라듐 사건에 대해서더 잘 알수 있는 계기가 된것도 좋았지만감각있는 배우들을 통해 바로 앞에서 그 인물들을 제대로 느껴볼수 있다는거그리고 너무나 풍부하고 감정 제대로 자극하는 노래로 꽉채운 무대를 즐길수 있다는거이따금씩 벅찬 감동을 간직한채 몇날 몇밤을 가슴두근거린다는거정말 너무 행복한 하루였답니다
2749,4,glosds1***예매자,2020.08.27,조회 44,공감 0공감하기,잘보고왔어요,코로나때문에 걱정이 많았지만 조심히 다녀왔어요재밌게 잘 봤습니다
2750,4,kyc***예매자,2020.08.27,조회 149,공감 2공감하기,옥주현은그냥,그냥미쳤어요  운좋게 취소표로 1열중앙에서 봤는데 성량미쳐버리고 연기미쳐버려요 걍미침
2751,5,gunn***예매자,2020.08.27,조회 59,공감 0공감하기,마리퀴리,코로나 때문에 걱정도 많이 했지만주현 님의 멋있는 공연을 볼 수 있었습니다
2752,5,showlif***예매자,2020.08.27,조회 87,공감 1공감하기,딸과 함께 본 감동의 뮤지컬이었습니다라이브 후기,이제 막 중1된 딸과 첫 뮤지컬을봤습니다 그 전에 레베카 보고싶었는데계속 예매도 안되고 시간도 안맞고 하다가마리퀴리에 믿고보는 옥배우가 출연한다는소식을 듣고 부랴부랴 예매했네요자리는 완전 로얄석은 아니었지만 통로쪽이라보는데 지장 1도 없었답니다무시무시한 성량과 연기력 옥주현 님 외에 주조연배우님들의 환상적인 조합이 너무너무 좋았습니다끝에 커튼콜할때 뭔가모를 뭉클함이래서 뮤지컬  뮤지컬 하는구나 를 느꼈던최고의 150 분이었습니다감사합니다배우님들
